<?xml version="1.0" encoding="UTF-8"?>
<defun name="shadow"
       internal="false"
       xsi:noNamespaceSchemaLocation="../../xsd/pnet.xsd"  
       xmlns:xsi="http://www.w3.org/2001/XMLSchema-instance"
>
  <include-structs href="line.xml"/>

<!--
 <in name="produces_forbidden_shadowing" type="point"/>
-->

  <net>

    <struct name="point">
      <field name="a" type="double"/>
      <field name="b" type="double"/>
      <field name="c" type="double"/>
    </struct>

    <transition name="trans">
      <include-function href="trans.xml"/>
    </transition>
  </net>
</defun>
